Предмет,ФИО преподавателя,ссылка
Инструменты трёхмерного моделирования в организациях химической отрасли,Озроков Ахмед Хамзатович,https://t.me/Ozrokov09
Управление данными в организациях химической отрасли,Дементиенко Андрей Владимирович ,+7 916 970-68-37
Язык программирования Python,Крашенинников Роман Сергеевич,https://t.me/KrashR135
Инструменты разработки и внутренней оптимизации веб- сайтов,Папаев Павел Леонидович,https://t.me/PaHaNproCS
Гибкое управление информационно-техническими проектами в химической отрасли,Копылова Лариса Евгеньевна,https://t.me/ag_starling
